{
  "$schema": "https://json-schema.org/draft/2020-12/schema",
  "type": "object",
  "properties": {
    "name": {
      "type": "string"
    },
    "description": {
      "type": "string"
    },
    "url": {
      "type": "string",
      "format": "uri"
    },
    "email": {
      "type": "string",
      "format": "email",
      "pattern": "^(?!\\.)(?!.*\\.\\.)([A-Za-z0-9_'+\\-\\.]*)[A-Za-z0-9_+-]@([A-Za-z0-9][A-Za-z0-9\\-]*\\.)+[A-Za-z]{2,}$"
    },
    "phone": {
      "type": "string"
    },
    "address": {
      "type": "string"
    },
    "ctaLabel": {
      "type": "string"
    },
    "ctaUrl": {
      "type": "string"
    },
    "socialLinks": {
      "default": [],
      "type": "array",
      "items": {
        "type": "object",
        "properties": {
          "label": {
            "type": "string"
          },
          "url": {
            "type": "string",
            "format": "uri"
          }
        },
        "required": [
          "label",
          "url"
        ]
      }
    },
    "$schema": {
      "type": "string"
    }
  },
  "required": [
    "name",
    "description",
    "url"
  ]
}