{
  "name": "Just Plaster",
  "description": "Melbourne's reliable plastering specialists — small to medium job experts with over 60 years combined experience.",
  "url": "https://justplaster.com.au",
  "email": "info@justplaster.com.au",
  "phone": "0414 945 931",
  "address": "Servicing all Melbourne suburbs",
  "ctaLabel": "Fast Free Quote",
  "ctaUrl": "/contact/",
  "socialLinks": [
    {
      "label": "Instagram",
      "url": "https://instagram.com/justplaster"
    }
  ]
}
